,index,GameID,DateTime_x,IsClosed,AwayTeamID,HomeTeamID,AwayTeamScore,HomeTeamScore,TeamID,Content,DateTime_y
40,153,22007,2023-10-02,True,22,24,3,4,24,"Calgary Flames left wing Jakob Pelletier was forced to make an early exit from Monday's preseason game versus Seattle, having suffered an upper-body injury. The 22-year-old got hurt in the final seconds of the first period when he was sent head-first into the boards by a hit from Kraken forward Marian Studenic. Pelletier notched an assist in the game and had two blocks with one hit before being forced to call it a night. Pelletier is hoping to crack the Flames roster full-time this season, and an injury could obviously derail his plans. The young forward collected seven points (three goals, four assists) in his first 24 career outings last season.",2023-09-26
41,322,21989,2023-09-30,True,16,2,4,6,2,"Buffalo Sabres center Matthew Savoie (shoulder) is on track to continue practicing next week. The 19-year-old hurt his shoulder in a prospects game at the start of last week. Savoie is looking to break into the Sabres team for the upcoming campaign after making his pro debut last term with a couple of AHL playoff games with the Rochester Americans. If he can't make the squad, Savoie is set to spend another season in the WHL, where he's tallied 192 points (73 goals, 119 assists) in 149 appearances.",2023-09-29
42,114,22229,2023-09-30,True,12,11,4,7,11,"New York Islanders right wing Kyle Palmieri (undisclosed) will undergo re-evaluation following the team's first preseason games. The Islanders will play the Rangers on Tuesday and clash with the Flyers on Wednesday. Palmieri has been skating on his own at the start of training camp due to an unspecified injury. Injuries have unfortunately accompanied Palmieri throughout his career. He hasn't hit 80 games in six seasons and was limited to 55 outings last term. The 32-year-old remains a capable player, though, and should fill a top-six role once he's healthy again.",2023-09-25
43,115,21983,2023-09-29,False,12,11,0,0,11,"New York Islanders right wing Kyle Palmieri (undisclosed) will undergo re-evaluation following the team's first preseason games. The Islanders will play the Rangers on Tuesday and clash with the Flyers on Wednesday. Palmieri has been skating on his own at the start of training camp due to an unspecified injury. Injuries have unfortunately accompanied Palmieri throughout his career. He hasn't hit 80 games in six seasons and was limited to 55 outings last term. The 32-year-old remains a capable player, though, and should fill a top-six role once he's healthy again.",2023-09-25
44,75,21988,2023-09-29,True,29,35,0,0,35,"Vegas Golden Knights defenseman Zach Whitecloud is troubled by an undisclosed injury and isn't expected to see the ice for the rest of the week. The 26-year-old was injured in Monday's preseason game against Colorado. Whitecloud missed significant time last season and must be desperate to avoid another lengthy spell on the sidelines. He featured 59 times during the regular season in 2022-23, registering 12 points (five goals, seven assists) with 97 blocks and 90 hits. Whitecloud added two goals and six assists in 22 playoff outings during the Golden Knights' road to winning the Stanley Cup.",2023-09-28
45,158,21986,2023-09-29,True,25,24,0,0,24,"Calgary Flames left wing Jakob Pelletier was forced to make an early exit from Monday's preseason game versus Seattle, having suffered an upper-body injury. The 22-year-old got hurt in the final seconds of the first period when he was sent head-first into the boards by a hit from Kraken forward Marian Studenic. Pelletier notched an assist in the game and had two blocks with one hit before being forced to call it a night. Pelletier is hoping to crack the Flames roster full-time this season, and an injury could obviously derail his plans. The young forward collected seven points (three goals, four assists) in his first 24 career outings last season.",2023-09-26
46,49,21976,2023-09-28,True,3,15,3,4,15,"Washington Capitals defenseman Joel Edmundson could be unavailable for the start of the season due to an upper-body injury. The big blue-liner was injured in Sunday's team scrimmage and hasn't been able to practice. Edmundson was picked up from Montreal for a seventh-round draft pick in the summer. He logged 13 points (two goals, 11 assists) in 61 games last season with the Canadiens, adding 149 blocks and 112 hits. Washington also lost Trevor van Riemsdyk from its blue line to injury in a preseason game over the weekend, but he has since been declared healthy and was back on the ice in Tuesday's practice.",2023-09-27
47,116,21968,2023-09-27,True,13,11,0,0,11,"New York Islanders right wing Kyle Palmieri (undisclosed) will undergo re-evaluation following the team's first preseason games. The Islanders will play the Rangers on Tuesday and clash with the Flyers on Wednesday. Palmieri has been skating on his own at the start of training camp due to an unspecified injury. Injuries have unfortunately accompanied Palmieri throughout his career. He hasn't hit 80 games in six seasons and was limited to 55 outings last term. The 32-year-old remains a capable player, though, and should fill a top-six role once he's healthy again.",2023-09-25
